{
    "schemaVersion":  "1.0.0",
    "workPackage":  "M0-DIA-10",
    "generatedAtUtc":  "2026-07-15T13:54:39.6328048Z",
    "executionStatus":  "InProgress",
    "gateStatus":  "Blocked",
    "blockerCode":  "EvidenceMissing",
    "result":  "Partial",
    "sourceRegistrySnapshotHash":  "37fe769b347f2f2fd5bca53d45e6706913185b7708750ad5d30243787f47a920",
    "sourceRegistryInventoryHash":  "a30d210fb0273323b17c9553e7a9e9bda9879e1c6d1478ffb8ff8325c67ccdc2",
    "sourceSessionInventoryHash":  "54be1c7e613138300995b97e589e4c4a2b891f46ffbc924499523af91d5b9a8c",
    "catalogId":  "gemuera.m0.dialect-plan-preflight",
    "catalogVersion":  "1.0.0",
    "catalogHash":  "4e9b62ba6bcb0e0f394a0fe6991f5ba33ecfa5faf6260dd971227fa814a97d5d",
    "preflightSetHash":  "d5cc089f073229aff0ea44436c7dfc2f559c83c0f785467921d035f0c815256b",
    "profiles":  [
                     {
                         "schemaVersion":  "1.0.0",
                         "preflightKind":  "StaticEvidenceSnapshot",
                         "profileId":  "snake",
                         "legacyCoreProfileEnum":  "Snake",
                         "requestMetadata":  {
                                                 "selectionSource":  "StaticContract",
                                                 "requestedGeneration":  0
                                             },
                         "registryEvidence":  {
                                                  "sourceWorkPackage":  "M0-DIA-02",
                                                  "sourceRegistrySnapshotHash":  "37fe769b347f2f2fd5bca53d45e6706913185b7708750ad5d30243787f47a920",
                                                  "sourceInventoryHash":  "a30d210fb0273323b17c9553e7a9e9bda9879e1c6d1478ffb8ff8325c67ccdc2",
                                                  "registryProjectionId":  "snake",
                                                  "projectionCanonicalHash":  "36662d51c416751ac7d73708b02ce9e3bdde56181ab4339c57c2896e050f4af0",
                                                  "selectedTestProjectionModuleIds":  [
                                                                                          "game.snake",
                                                                                          "gemuera.v24",
                                                                                          "legacy.current.common",
                                                                                          "legacy.current.expression"
                                                                                      ],
                                                  "instructionCount":  326,
                                                  "expressionFunctionCount":  360
                                              },
                         "sessionEvidence":  {
                                                 "sourceWorkPackage":  "M0-SES-01",
                                                 "sourceSessionInventoryHash":  "54be1c7e613138300995b97e589e4c4a2b891f46ffbc924499523af91d5b9a8c",
                                                 "rootStateInventoryCount":  31,
                                                 "currentRuntimeIsolationStatus":  "Failed",
                                                 "parserVmConsumptionStatus":  "NotConsumed",
                                                 "m1EligibilityStatus":  "Blocked"
                                             },
                         "planSemanticHash":  "a85167415d478dad9e63c858a6b217a4654d6d8ed43cf9b5674f1df1e7159d1f",
                         "uncovered":  [
                                           "This is a source-only static evidence snapshot, not a runtime DialectPlan or CompatibilityPlan.",
                                           "Selection source and requested generation are audit metadata and are intentionally excluded from planSemanticHash.",
                                           "Parser/VM consumption, frozen registry construction, resolver behavior, ownership decisions, aliases, replacements and behavior fixtures remain outside M0-DIA-10."
                                       ]
                     },
                     {
                         "schemaVersion":  "1.0.0",
                         "preflightKind":  "StaticEvidenceSnapshot",
                         "profileId":  "v24pure",
                         "legacyCoreProfileEnum":  "V24Pure",
                         "requestMetadata":  {
                                                 "selectionSource":  "StaticContract",
                                                 "requestedGeneration":  0
                                             },
                         "registryEvidence":  {
                                                  "sourceWorkPackage":  "M0-DIA-02",
                                                  "sourceRegistrySnapshotHash":  "37fe769b347f2f2fd5bca53d45e6706913185b7708750ad5d30243787f47a920",
                                                  "sourceInventoryHash":  "a30d210fb0273323b17c9553e7a9e9bda9879e1c6d1478ffb8ff8325c67ccdc2",
                                                  "registryProjectionId":  "v24",
                                                  "projectionCanonicalHash":  "562245d10109c9ccfdc92109b7a8f6e354ad2b5ec84ed7150dbccacff353c075",
                                                  "selectedTestProjectionModuleIds":  [
                                                                                          "gemuera.v24",
                                                                                          "legacy.current.common",
                                                                                          "legacy.current.expression"
                                                                                      ],
                                                  "instructionCount":  290,
                                                  "expressionFunctionCount":  358
                                              },
                         "sessionEvidence":  {
                                                 "sourceWorkPackage":  "M0-SES-01",
                                                 "sourceSessionInventoryHash":  "54be1c7e613138300995b97e589e4c4a2b891f46ffbc924499523af91d5b9a8c",
                                                 "rootStateInventoryCount":  31,
                                                 "currentRuntimeIsolationStatus":  "Failed",
                                                 "parserVmConsumptionStatus":  "NotConsumed",
                                                 "m1EligibilityStatus":  "Blocked"
                                             },
                         "planSemanticHash":  "9ca70bf06026c7e69db58a5521b94f86cb2bc4fb6ed6b543049e7bc127c712f2",
                         "uncovered":  [
                                           "This is a source-only static evidence snapshot, not a runtime DialectPlan or CompatibilityPlan.",
                                           "Selection source and requested generation are audit metadata and are intentionally excluded from planSemanticHash.",
                                           "Parser/VM consumption, frozen registry construction, resolver behavior, ownership decisions, aliases, replacements and behavior fixtures remain outside M0-DIA-10."
                                       ]
                     }
                 ],
    "unsupportedLegacyCoreProfiles":  [
                                          {
                                              "legacyCoreProfileEnum":  "SnakeModernMobile",
                                              "status":  "Uncovered",
                                              "reason":  "No independent DIA-02 registry projection or static session evidence proves that SnakeModernMobile has Snake-equivalent semantics."
                                          }
                                      ],
    "currentRuntimeIsolation":  {
                                    "status":  "Failed",
                                    "reason":  "DIA-02 and M0-SES-01 both show process-wide legacy state/registration; this preflight does not isolate a runtime session."
                                },
    "parserVmConsumption":  {
                                "status":  "NotConsumed",
                                "reason":  "DIA-10 is emitted by an offline evidence tool and is not read by the legacy Parser or VM."
                            },
    "compatibilityPlanRuntime":  {
                                     "status":  "NotImplemented",
                                     "reason":  "No runtime CompatibilityPlan, resolver, feature flag, session facade or frozen registry is created by M0-DIA-10."
                                 },
    "m1Eligibility":  {
                          "status":  "Blocked",
                          "reason":  "The M0-SES-01 source inventory remains blocked; this static preflight is input evidence, not M1 session isolation."
                      },
    "uncovered":  [
                      "DIA-10 is a reproducible source-only preflight snapshot, not a runtime CompatibilityPlan or DialectPlan.",
                      "Only v24pure and snake have evidence-backed DIA-02 test projections; SnakeModernMobile remains explicitly Uncovered.",
                      "The old runtime remains globally coupled: currentRuntimeIsolation=Failed and parserVmConsumption=NotConsumed.",
                      "No LegacySessionFacade, feature flag, resolver, Parser/VM switch, D2 frozen registry, game execution, APK or device evidence is introduced."
                  ]
}
